{
  "id": "bandit",
  "name": "Bandit",
  "source": "original",
  "size": "medium",
  "creatureType": "humanoïde",
  "alignment": "chaotique neutre",
  "silhouette": "humanoid",
  "description": "Un coupe-jarret des bas quartiers de la Capitale, enrôlé à la journée par le maître d'arène pour donner la réplique aux condamnés. Il combat en cuir, cimeterre à la main, et cherche le contact : à deux sur une même cible, ses coups portent mieux.",
  "abilities": {
    "strength": 11,
    "dexterity": 12,
    "constitution": 12,
    "intelligence": 10,
    "wisdom": 10,
    "charisma": 10
  },
  "armorClass": 12,
  "hitPoints": 11,
  "hitDice": "2d8+2",
  "speed": {
    "walk": 9
  },
  "challengeRating": 0.125,
  "senses": [
    "Perception passive 10"
  ],
  "languages": [
    "commun"
  ],
  "actions": [
    {
      "name": "Cimeterre",
      "text": "Attaque au corps à corps avec une arme : +3 au toucher, allonge 1,50 m, une cible. Touché : 4 (1d6 + 1) dégâts tranchants.",
      "attackBonus": 3,
      "reach": 1.5,
      "damage": "1d6+1",
      "damageType": "slashing"
    }
  ]
}
